phenomenon;sentence_good;sentence_bad
ART. NOUN AGR. SG.;Det slumrade en sång i lekandet;Det slumrade en sånger i leklandet
ART. NOUN AGR. SG.;Det utvecklades en röksvans på området;Det utvecklades en röksvansar på området
ART. NOUN AGR. SG.;Det dog en ugn bakom kvarteret;Det dog en ugnar bakom kvarteret
ART. NOUN AGR. SG.;Det sprang en hyena framför distriktet;Det sprang en hyenor framför distriktet
ART. NOUN AGR. SG.;Det lurade en psalm över landet;Det lurade en psalmer över landet
ART. NOUN AGR. SG.;Det försvann en kyrka i riket;Det försvann en kyrkor i riket
ART. NOUN AGR. SG.;Det uppstod en blomma vid kungariket;Det uppstod en blommor vid kungariket
ART. NOUN AGR. SG.;Det vilade en spegel på landet;Det vilade en speglar på landet
ART. NOUN AGR. SG.;Det sköt en mur genom riket;Det sköt en murar genom riket
EMBEDDED V2 AdvP.;Olle påstod att Lisa alltid läser böcker på kvällen;Olle påstod att Lisa läser alltid böcker på kvällen
EMBEDDED V2 AdvP.;Anna menade att John alltid kastar mat på morgonen;Anna menade att John kastar alltid mat på morgonen
EMBEDDED V2 AdvP.;Hanna hävdade att Nils aldrig slår kossor på eftermiddagen;Hanna hävdade att Nils slår aldrig kossor på eftermiddagen
EMBEDDED V2 AdvP.;Niklas utbrast att Johanna ofta kramar bläckfiskar om dagarna;Niklas utbrast att Johanna kramar ofta bläckfiskar om dagarna
EMBEDDED V2 AdvP.;Pelle framhöll att Sonja sällan säljer hus på natten;Pelle framhöll att Sonja säljer sällan hus på natten
EMBEDDED V2 AdvP.;Rebecka gissade att Klara ofta river ner tavlor från väggen;Rebecka gissade att Klara river ofta ner tavlor från väggen
EMBEDDED V2 AdvP.;Herrarna proklamerade att företaget ofta skövlar skog på sommaren;Herrarna proklamerade att företaget skövlar ofta skog på sommaren
EMBEDDED V2 AdvP.;Sara deklarerade att bågen ofta missar måltavlan på trädet;Sara deklarerade att bågen missar ofta måltavlan på trädet
EMBEDDED V2 AdvP.;Tjuvarna försäkrade att banken ibland lägger pengar på disken;Tjuvarna försäkrade att banken lägger ibland pengar på disken
EMBEDDED V2 AdvP.;Ormen intygade att råttan sällan äter ost i skymningen;Ormen intygade att råttan äter sällan ost i skymningen
EMBEDDED V2 AdvP.;Nils påstod att Jonas aldrig köper marmeladburken på morgonen;Nils påstod att Jonas köper aldrig marmeladburken på morgonen
EMBEDDED V2 AdvP.;Jonas menade att Alf alltid säljer gardinen på kvällen;Jonas menade att Alf säljer alltid gardinen på kvällen
EMBEDDED V2 AdvP.;Alf hävdade att Katrin ofta öppnar affären på natten;Alf hävdade att Katrin öppnar ofta affären på natten
EMBEDDED V2 AdvP.;Katrin förklarade att Niklas ibland kastar skruvdragaren på dagen;Katrin förklarade att Niklas kastar ibland skruvdragaren på dagen
EMBEDDED V2 AdvP.;Niklas berättade att Sara sällan firar mannen på eftermiddagen;Niklas berättade att Sara firar sällan mannen på eftermiddagen
EMBEDDED V2 AdvP.;Sara menade att Viola oftast läser tidningen på förmiddagen;Sara menade att Viola läser oftast tidningen på förmiddagen
EMBEDDED V2 AdvP.;Viola tillade att Flora stundom skapar kartan på helgen;Viola tillade att Flora skapar stundom kartan på helgen
EMBEDDED V2 AdvP.;Flora påtalade att Anna numera läser rapporten på vardagar;Flora påtalade att Anna läser numera rapporten på vardagar
EMBEDDED V2 AdvP.;Anna svarade att Sofie dagligen bygger maskiner på måndagar;Anna svarade att Sofie bygger dagligen maskiner på måndagar
EMBEDDED V2 AdvP.;Sofie anmärkte att Murat ständigt river byggnader på tisdagar;Sofie anmärkte att Murat river ständigt byggnader på tisdagar
EMBEDDED V2 AdvP.;Murat noterade att Muhammed vanligen kastar tavlan på onsdagen;Murat noterade att Muhammed kastar vanligen tavlan på onsdagen
EMBEDDED V2 AdvP.;Muhammed menade att Ahmed sällan tar gaffeln på torsdagen;Muhammed menade att Ahmed tar sällan gaffeln på torsdagen
EMBEDDED V2 AdvP.;Ahmed invände att Mats vanligtvis bär kompassen på sommaren;Ahmed invände att Mats bär vanligtvis kompassen på sommaren
EMBEDDED V2 AdvP.;Mats underströk att Eva ibland glömmer nappen på lördagen;Mats underströk att Eva glömmer ibland nappen på lördagen
EMBEDDED V2 AdvP.;Eva framförde att Fredrik alltid hämtar lådan på kvällen;Eva framförde att Fredrik hämtar alltid lådan på kvällen
EMBEDDED V2 AdvP.;Fredrik poängterade att Johan ofta slår knopen på måndagar;Fredrik poängterade att Johan slår ofta knopen på måndagar
EMBEDDED V2 AdvP.;Johan konstaterade att Meriem aldrig sparkar personal på tisdagar;Johan konstaterade att Meriem sparkar aldrig personal på tisdagar
EMBEDDED V2 AdvP.;Meriem bekräftade att Beata ibland lyfter skålen på onsdagar;Meriem bekräftade att Beata lyfter ibland skålen på onsdagar
EMBEDDED V2 AdvP.;Beata förnekade att Joakim aldrig flyttar soppan på torsdagar;Beata förnekade att Joakim flyttar aldrig soppan på torsdagar
EMBEDDED V2 AdvP.;Joakim medgav att Robert alltid fyller hatten på fredagar;Joakim medgav att Robert fyller alltid hatten på fredagar
EMBEDDED V2 AdvP.;Robert upprepade att Emanuel oavbrutet tömmer skärmen på lördagar;Robert upprepade att Emanuel tömmer oavbrutet skärmen på lördagar
EMBEDDED V2 AdvP.;Emanuel påpekade att Tobias emellanåt håller leksaken på söndagar;Emanuel påpekade att Tobias håller emellanåt leksaken på söndagar
EMBEDDED V2 AdvP.;Tobias antydde att Daniel aldrig släpper flaskan i januari;Tobias antydde att Daniel släpper aldrig flaskan i januari
EMBEDDED V2 AdvP.;Daniel resonerade att Torgny alltid stänger asken i februari;Daniel resonerade att Torgny stänger alltid asken i februari
EMBEDDED V2 AdvP.;Torgny påstod att Erik ofta stänger påsen i mars;Torgny påstod att Erik stänger ofta påsen i mars
EMBEDDED V2 AdvP.;Erik menade att Ulla ofta använder piskan i april;Erik menade att Ulla använder ofta piskan i april
EMBEDDED V2 AdvP.;Ulla menade att Anders sällan hittar pjäsen i maj;Ulla menade att Anders hittar sällan pjäsen i maj
EMBEDDED V2 AdvP.;Anders medgav att Kristina oftast tappar humöret i juni;Anders medgav att Kristina tappar oftast humöret i juni
EMBEDDED V2 AdvP.;Kristina kommenterade att Klara stundom lagar motorn i juli;Kristina kommenterade att Klara lagar stundom motorn i juli
EMBEDDED V2 AdvP.;Klara erkände att Olle ofta ser tröjan i augusti;Klara erkände att Olle ser ofta tröjan i augusti
EMBEDDED V2 AdvP.;Olle påstod att Helga ofta hör spiken i september;Olle påstod att Helga hör ofta spiken i september
EMBEDDED V2 AdvP.;Helga förtydligade att Karl sällan stänger butiken i oktober;Helga förtydligade att Karl stänger sällan butiken i oktober
EMBEDDED V2 AdvP.;Karl beskrev att Uma ofta använder tvålen i november;Karl beskrev att Uma använder ofta tvålen i november
EMBEDDED V2 AdvP.;Uma rapporterade att Alba alltid lagar västen i december;Uma rapporterade att Alba lagar alltid västen i december
EMBEDDED V2 AdvP.;Alba menade att Rune ofta glömmer kartan på vintern;Alba menade att Rune glömmer ofta kartan på vintern
EMBEDDED V2 AdvP.;Rune påstod att Iris ofta minns parfymen på våren;Rune påstod att Iris minns ofta parfymen på våren
EMBEDDED V2 AdvP.;Iris förutsatte att Vive ofta använder spaden på sommaren;Iris förutsatte att Vive använder ofta spaden på sommaren
EMBEDDED V2 AdvP.;Vive föreslog att Dick aldrig hatar tunnan på hösten;Vive föreslog att Dick hatar aldrig tunnan på hösten
EMBEDDED V2 AdvP.;Dick bestyrkte att Runar sällan glömmer fiolen på sportlovet;Dick bestyrkte att Runar glömmer sällan fiolen på sportlovet
EMBEDDED V2 AdvP.;Runar förutspådde att Janice alltid vill jackan på höstlovet;Runar förutspådde att Janice vill alltid jackan på höstlovet
EMBEDDED V2 AdvP.;Janice förutsåg att Elias ibland behöver stöveln på vinterlovet;Janice förutsåg att Elias behöver ibland stöveln på vinterlovet
EMBEDDED V2 AdvP.;Elias förmodade att Pontus alltid använder bollen på sommarlovet;Elias förmodade att Pontus använder alltid bollen på sommarlovet
EMBEDDED V2 AdvP.;Pontus misstänkte att Albin aldrig missar bokbussen på semestern;Pontus misstänkte att Albin missar aldrig bokbussen på semestern
EMBEDDED V2 AdvP.;Albin betvivlade att Nico aldrig läser tidningen på påsken;Albin betvivlade att Nico läser aldrig tidningen på påsken
EMBEDDED V2 AdvP.;Nico påstod att Josefin aldrig väcker djuret på julen;Nico påstod att Josefin väcker aldrig djuret på julen
EMBEDDED V2 AdvP.;Josefin antog att Nicole alltid söver barnen på midsommar;Josefin antog att Nicole söver alltid barnen på midsommar
EMBEDDED V2 AdvP.;Nicole beklagade att Hanna ofta tvättar grytan på nyår;Nicole beklagade att Hanna tvättar ofta grytan på nyår
EMBEDDED V2 AdvP.;Hanna missade att Fanny ibland städar rummet på födelsedagen;Hanna missade att Fanny städar ibland rummet på födelsedagen
EMBEDDED V2 AdvP.;Fanny påstod att Ida sällan lagar mat på bröllopsdagen;Fanny påstod att Ida lagar sällan mat på bröllopsdagen
EMBEDDED V2 AdvP.;Ida berättade att Maj oftast väcker assistenten på natten;Ida berättade att Maj väcker oftast assistenten på natten
EMBEDDED V2 AdvP.;Maj inflikade att Majken stundom steker löken om kvällarna;Maj inflikade att Majken steker stundom löken om kvällarna
EMBEDDED V2 AdvP.;Majken menade att Linn numera gräddar bullarna på kvällen;Majken menade att Linn gräddar numera bullarna på kvällen
EMBEDDED V2 AdvP.;Linn inflikade att Alexander dagligen skjuter pärlan på framtiden;Linn inflikade att Alexander skjuter dagligen pärlan på framtiden
EMBEDDED V2 AdvP.;Alexander påstod att Erika ständigt slår knoparna på dagen;Alexander påstod att Erika slår ständigt knoparna på dagen
EMBEDDED V2 AdvP.;Erika tillkännagav att Sandra vanligen ringer vännen på kvällen;Erika tillkännagav att Sandra ringer vanligen vännen på kvällen
EMBEDDED V2 AdvP.;Sandra menade att Kristin för det mesta äter mat på dagarna;Sandra menade att Kristin äter för det mesta mat på dagarna
EMBEDDED V2 AdvP.;Kristin tillstod att Christine vanligtvis smeker publiken i kvällningen;Kristin tillstod att Christine smeker vanligtvis publiken i kvällningen
EMBEDDED V2 AdvP.;Christine bedyrade att Caroline regelbundet använder rutan på sommaren;Christine bedyrade att Caroline använder regelbundet rutan på sommaren
EMBEDDED V2 AdvP.;Caroline framhöll att Ingrid ofta slänger skräpet på torsdagar;Caroline framhöll att Ingrid slänger ofta skräpet på torsdagar
EMBEDDED V2 AdvP.;Ingrid uttryckte att Inger hädanefter får saxen på morgonen;Ingrid uttryckte att Inger får hädanefter saxen på morgonen
EMBEDDED V2 AdvP.;Inger fastslog att Aina framöver beställer frimärket under natten;Inger fastslog att Aina beställer framöver frimärket under natten
EMBEDDED V2 AdvP.;Aina förkunnade att Ebba fortfarande avbeställer dörren under dagen;Aina förkunnade att Ebba avbeställer fortfarande dörren under dagen
EMBEDDED V2 AdvP.;Ebba proklamerade att Ellen ännu samlar veden under veckan;Ebba proklamerade att Ellen samlar ännu veden under veckan
EMBEDDED V2 AdvP.;Ellen deklarerade att Helena regelbundet sprider fröna under natten;Ellen deklarerade att Helena sprider regelbundet fröna under natten
EMBEDDED V2 AdvP.;Helena försäkrade att Kerstin oavbrutet delar bryggan under året;Helena försäkrade att Kerstin delar oavbrutet bryggan under året
EMBEDDED V2 AdvP.;Kerstin förklarade att Adam emellanåt läser läxan under hösten;Kerstin förklarade att Adam läser emellanåt läxan under hösten
EMBEDDED V2 AdvP.;Adam förklarade att Magdalena aldrig översätter artiklar under vintern;Adam förklarade att Magdalena översätter aldrig artiklar under vintern
EMBEDDED V2 AdvP.;Magdalena påstod att Alice alltid löser problemet under våren;Magdalena påstod att Alice löser alltid problemet under våren
EMBEDDED V2 AdvP.;Alice menade att Josef ofta beskriver skivan under sommaren;Alice menade att Josef beskriver ofta skivan under sommaren
EMBEDDED V2 AdvP.;Josef hävdade att John ibland berättar sagan under helgen;Josef hävdade att John berättar ibland sagan under helgen
EMBEDDED V2 AdvP.;John påpekade att Christel sällan anmäler brottet under julen;John påpekade att Christel anmäler sällan brottet under julen
EMBEDDED V2 AdvP.;Christel påpekade att Ann-Katrin oftast avslutar jobbet under påsken;Christel påpekade att Ann-Katrin avslutar oftast jobbet under påsken
EMBEDDED V2 AdvP.;Ann-Katrin påstod att Anna-Lena stundom påbörjar tankegången under kriget;Ann-Katrin påstod att Anna-Lena påbörjar stundom tankegången under kriget
EMBEDDED V2 AdvP.;Anna-Lena hävdade att Nada numera inleder ritualen på kvällen;Anna-Lena hävdade att Nada inleder numera ritualen på kvällen
EMBEDDED V2 AdvP.;Nada menade att Linda dagligen avbryter skivan under sommarlovet;Nada menade att Linda avbryter dagligen skivan under sommarlovet
EMBEDDED V2 AdvP.;Linda svarade att Maria ständigt stänger boken under höstlovet;Linda svarade att Maria stänger ständigt boken under höstlovet
EMBEDDED V2 AdvP.;Maria berättade att Ted vanligen fortsätter arbetet under vinterlovet;Maria berättade att Ted fortsätter vanligen arbetet under vinterlovet
EMBEDDED V2 AdvP.;Ted förklarade att Tobias för det mesta räddar skruven under sportlovet;Ted förklarade att Tobias räddar för det mesta skruven under sportlovet
EMBEDDED V2 AdvP.;Tobias invände att Björn vanligtvis förstör klubban på morgondagen;Tobias invände att Björn förstör vanligtvis klubban på morgondagen
EMBEDDED V2 AdvP.;Björn antydde att Tryggve ofta tar bort växeln på kvällarna;Björn antydde att Tryggve tar bort ofta växeln på kvällarna
EMBEDDED V2 AdvP.;Tryggve menade att Maude sällan låser dörren på nätterna;Tryggve menade att Maude låser sällan dörren på nätterna
EMBEDDED V2 AdvP.;Maude konstaterade att Adina ofta packar väskan på dagarna;Maude konstaterade att Adina packar ofta väskan på dagarna
EMBEDDED V2 AdvP.;Adina underströk att Freja sällan ser solen på eftermiddagarna;Adina underströk att Freja ser sällan solen på eftermiddagarna
EMBEDDED V2 AdvP.;Freja bekräftade att Otis fortfarande ändrar pinnen på förmiddagarna;Freja bekräftade att Otis ändrar fortfarande pinnen på förmiddagarna
EMBEDDED V2 AdvP.;Otis erkände att Ylva ännu slår rekordet på helgerna;Otis erkände att Ylva slår ännu rekordet på helgerna
EMBEDDED V2 AdvP.;Ylva medgav att Oscar regelbundet kastar snöret på vardagarna;Ylva medgav att Oscar kastar regelbundet snöret på vardagarna
EMBEDDED V2 AdvP.;Oscar proklamerade att Henning oavbrutet hindrar pärlan på vintrarna;Oscar proklamerade att Henning hindrar oavbrutet pärlan på vintrarna
EMBEDDED V2 AdvP.;Henning tillade att Saga emellanåt klandrar stämpeln på somrarna;Henning tillade att Saga klandrar emellanåt stämpeln på somrarna
EMBEDDED V2 AdvP.;Saga påstod att Klas alltid vinner priset på våren;Saga påstod att Klas vinner alltid priset på våren
EMBEDDED V2 AdvP.;Klas menade att Avdyl sällan kramar vännerna på vårarna;Klas menade att Avdyl kramar sällan vännerna på vårarna
EMBEDDED V3 CL.;Olle påstod att när det blir kväll läser Lisa böcker i köket;Olle påstod att när det blir kväll Lisa läser böcker i köket
EMBEDDED V3 CL.;Anna menade att när det blir morgon kastar John pil i trädgården;Anna menade att när det blir morgon John kastar pil i trädgården
EMBEDDED V3 CL.;Hanna hävdade att när det blir eftermiddag slår Nils kossor i ladan;Hanna hävdade att när det blir eftermiddag Nils slår kossor i ladan
EMBEDDED V3 CL.;Niklas utbrast att när det är sommar kramar Johanna bläckfiskar på golvet;Niklas utbrast att när det är sommar Johanna kramar bläckfiskar på golvet
EMBEDDED V3 CL.;Pelle framhöll att när det blir natt säljer Sonja villor på ängen;Pelle framhöll att när det blir natt Sonja säljer villor på ängen
EMBEDDED V3 CL.;Rebecka tillkännagav att när det blir oktober dricker Klara vin vid bordet;Rebecka tillkännagav att när det blir oktober Klara dricker vin vid bordet
EMBEDDED V3 CL.;Herrarna proklamerade att när det blir sommar skövlar maskinerna skog i Brasilien;Herrarna proklamerade att när det blir sommar maskinerna skövlar skog i Brasilien
EMBEDDED V3 CL.;Sara deklarerade att när det blir julafton missar gästerna maten på bordet;Sara deklarerade att när det blir julafton gästerna missar maten på bordet
EMBEDDED V3 CL.;Tjuvarna försäkrade att när det blir högsäsong håller banken kunderna om ryggen;Tjuvarna försäkrade att när det blir högsäsong banken håller kunderna om ryggen
EMBEDDED V3 CL.;Ormen bedyrade att när hösten kommer äter råttan osten;Ormen bedyrade att när hösten kommer råttan äter osten
EMBEDDED V3 CL.;Nils menade att när det blir kväll missar Jonas stolarna från vardagsrummet;Nils menade att när det blir kväll Jonas missar stolarna från vardagsrummet
EMBEDDED V3 CL.;Jonas invände att när det blir morgon målar Alf väggar på gardinen;Jonas invände att när det blir morgon Alf målar väggar på gardinen
EMBEDDED V3 CL.;Alf underströk att när det blir eftermiddag äter Katrin kakor på teckningen;Alf underströk att när det blir eftermiddag Katrin äter kakor på teckningen
EMBEDDED V3 CL.;Katrin framförde att när det blir natt köper Niklas datorer i affären;Katrin framförde att när det blir natt Niklas köper datorer i affären
EMBEDDED V3 CL.;Niklas poängterade att när det blir oktober säljer Sara telefoner till bonden;Niklas poängterade att när det blir oktober Sara säljer telefoner till bonden
EMBEDDED V3 CL.;Sara konstaterade att när det blir sommar öppnar Viola skor i väskan;Sara konstaterade att när det blir sommar Viola öppnar skor i väskan
EMBEDDED V3 CL.;Viola bekräftade att när det blir julafton kastar Flora jackor med handsken;Viola bekräftade att när det blir julafton Flora kastar jackor med handsken
EMBEDDED V3 CL.;Flora förnekade att när det blir högsäsong firar Anna mössor utan snäckan;Flora förnekade att när det blir högsäsong Anna firar mössor utan snäckan
EMBEDDED V3 CL.;Anna medgav att när det blir afton läser Sofie böcker i maskinen;Anna medgav att när det blir afton Sofie läser böcker i maskinen
EMBEDDED V3 CL.;Sofie upprepade att när det blir tisdag skrapar Murat pennor mot pärmen;Sofie upprepade att när det blir tisdag Murat skrapar pennor mot pärmen
EMBEDDED V3 CL.;Murat påpekade att när det blir måndag ritar Nils hundar på tavlan;Murat påpekade att när det blir måndag Nils ritar hundar på tavlan
EMBEDDED V3 CL.;Muhammed menade att när det blir vår bygger Ahmed hus under marken;Muhammed menade att när det blir vår Ahmed bygger hus under marken
EMBEDDED V3 CL.;Ahmed inflikade att när det blir höst river Mats fåglar med kompassen;Ahmed inflikade att när det blir höst Mats river fåglar med kompassen
EMBEDDED V3 CL.;Mats bedyrade att när det blir jul kastar Eva fiskar efter nappen;Mats bedyrade att när det blir jul Eva kastar fiskar efter nappen
EMBEDDED V3 CL.;Eva påstod att när det blir möte köper Fredrik blommor från lådan;Eva påstod att när det blir möte Fredrik köper blommor från lådan
EMBEDDED V3 CL.;Fredrik menade att när det blir kväll bär Johan träd genom skogen;Fredrik menade att när det blir kväll Johan bär träd genom skogen
EMBEDDED V3 CL.;Johan påpekade att när det blir morgon glömmer Meriem ringar på torget;Johan påpekade att när det blir morgon Meriem glömmer ringar på torget
EMBEDDED V3 CL.;Meriem påstod att när det blir eftermiddag hämtar Beata skålar från floden;Meriem påstod att när det blir eftermiddag Beata hämtar skålar från floden
EMBEDDED V3 CL.;Beata menade att när det blir natt kastar Joakim fiskar åt männen;Beata menade att när det blir natt Joakim kastar fiskar åt männen
EMBEDDED V3 CL.;Joakim bedyrade att när det blir oktober sparkar Robert berg kring hatten;Joakim bedyrade att när det blir oktober Robert sparkar berg kring hatten
EMBEDDED V3 CL.;Robert antydde att när det blir sommar lyfter Emanuel stenar runt skärmen;Robert antydde att när det blir sommar Emanuel lyfter stenar runt skärmen
EMBEDDED V3 CL.;Emanuel resonerade att när det blir julafton flyttar Tobias vägar mellan bergen;Emanuel resonerade att när det blir julafton Tobias flyttar vägar mellan bergen
EMBEDDED V3 CL.;Tobias påstod att när det blir högsäsong fyller Daniel flaskor bakom tinget;Tobias påstod att när det blir högsäsong Daniel fyller flaskor bakom tinget
EMBEDDED V3 CL.;Daniel menade att när det blir afton tömmer Torgny hus framför asken;Daniel menade att när det blir afton Torgny tömmer hus framför asken
EMBEDDED V3 CL.;Torgny menade att när det blir tisdag håller Erik mat framför påsen;Torgny menade att när det blir tisdag Erik håller mat framför påsen
EMBEDDED V3 CL.;Erik medgav att när det blir måndag släpper Ulla fönster på piskan;Erik medgav att när det blir måndag Ulla släpper fönster på piskan
EMBEDDED V3 CL.;Ulla kommenterade att när det blir vår stänger Anders dörrar från pjäsen;Ulla kommenterade att när det blir vår Anders stänger dörrar från pjäsen
EMBEDDED V3 CL.;Anders erkände att när det blir höst slänger Kristina lampor på taket;Anders erkände att när det blir höst Kristina slänger lampor på taket
EMBEDDED V3 CL.;Kristina påstod att när det blir jul använder Klara olja i motorn;Kristina påstod att när det blir jul Klara använder olja i motorn
EMBEDDED V3 CL.;Klara förtydligade att när det blir möte hittar Olle klockor till tröjan;Klara förtydligade att när det blir möte Olle hittar klockor till tröjan
EMBEDDED V3 CL.;Olle beskrev att när det blir kväll tappar Helga lampor på spiken;Olle beskrev att när det blir kväll Helga tappar lampor på spiken
EMBEDDED V3 CL.;Helga rapporterade att när det blir morgon lagar Karl soffor med skruvmejseln;Helga rapporterade att när det blir morgon Karl lagar soffor med skruvmejseln
EMBEDDED V3 CL.;Karl menade att när det blir eftermiddag ser Uma sängar utan tvålen;Karl menade att när det blir eftermiddag Uma ser sängar utan tvålen
EMBEDDED V3 CL.;Uma påstod att när det blir natt hör Alba mattor i västen;Uma påstod att när det blir natt Alba hör mattor i västen
EMBEDDED V3 CL.;Alba förutsatte att när det blir oktober stänger Rune pannor med kartan;Alba förutsatte att när det blir oktober Rune stänger pannor med kartan
EMBEDDED V3 CL.;Rune föreslog att när det blir sommar använder Iris grytor vid parfymen;Rune föreslog att när det blir sommar Iris använder grytor vid parfymen
EMBEDDED V3 CL.;Iris bestyrkte att när det blir julafton lagar Vive spisar under spaden;Iris bestyrkte att när det blir julafton Vive lagar spisar under spaden
EMBEDDED V3 CL.;Vive förutspådde att när det blir högsäsong glömmer Dick ugnar på tunnan;Vive förutspådde att när det blir högsäsong Dick glömmer ugnar på tunnan
EMBEDDED V3 CL.;Dick förutsåg att när det blir afton minns Runar knivar efter fiolen;Dick förutsåg att när det blir afton Runar minns knivar efter fiolen
EMBEDDED V3 CL.;Runar förmodade att när det blir tisdag använder Janice gafflar på jackan;Runar förmodade att när det blir tisdag Janice använder gafflar på jackan
EMBEDDED V3 CL.;Janice misstänkte att när det blir måndag hatar Elias skedar bakom stöveln;Janice misstänkte att när det blir måndag Elias hatar skedar bakom stöveln
EMBEDDED V3 CL.;Elias menade att när det blir vår glömmer Pontus glas i skogen;Elias menade att när det blir vår Pontus glömmer glas i skogen
EMBEDDED V3 CL.;Pontus påstod att när det blir höst tömmer Albin flaskor hos männen;Pontus påstod att när det blir höst Albin tömmer flaskor hos männen
EMBEDDED V3 CL.;Albin antog att när det blir jul behöver Nico koppar åt kikaren;Albin antog att när det blir jul Nico behöver koppar åt kikaren
EMBEDDED V3 CL.;Nico menade att när det blir möte använder Josefin tallrikar kring vispen;Nico menade att när det blir möte Josefin använder tallrikar kring vispen
EMBEDDED V3 CL.;Josefin påstod att när det blir kväll missar Nicole påsar på gården;Josefin påstod att när det blir kväll Nicole missar påsar på gården
EMBEDDED V3 CL.;Nicole påstod att när det blir morgon läser Hanna lådor i grytan;Nicole påstod att när det blir morgon Hanna läser lådor i grytan
EMBEDDED V3 CL.;Hanna berättade att när det blir eftermiddag ställer Fanny slevar bakom hyllan;Hanna berättade att när det blir eftermiddag Fanny ställer slevar bakom hyllan
EMBEDDED V3 CL.;Fanny inflikade att när det blir natt söver Ida djur framför mattan;Fanny inflikade att när det blir natt Ida söver djur framför mattan
EMBEDDED V3 CL.;Ida menade att när det blir oktober tvättar Maj bokstäver bredvid plånboken;Ida menade att när det blir oktober Maj tvättar bokstäver bredvid plånboken
EMBEDDED V3 CL.;Maj inflikade att när det blir sommar städar Majken ord på stolen;Maj inflikade att när det blir sommar Majken städar ord på stolen
EMBEDDED V3 CL.;Majken påstod att när det blir julafton lagar Linn majs från hinken;Majken påstod att när det blir julafton Linn lagar majs från hinken
EMBEDDED V3 CL.;Linn tillkännagav att när det blir högsäsong väcker Alexander texter på pärlan;Linn tillkännagav att när det blir högsäsong Alexander väcker texter på pärlan
EMBEDDED V3 CL.;Alexander menade att när det blir afton ritar Erika bilder på plankan;Alexander menade att när det blir afton Erika ritar bilder på plankan
EMBEDDED V3 CL.;Erika tillstod att när det blir tisdag gräddar Sandra målningar till väven;Erika tillstod att när det blir tisdag Sandra gräddar målningar till väven
