phenomenon;sentence_good;sentence_bad
V2 REL. CL.;Robert tömmer hatten som Joakim inte fyller;Robert tömmer hatten som Joakim fyller inte
V2 REL. CL.;Emanuel håller skärmen som Robert inte tömmer;Emanuel håller skärmen som Robert tömmer inte
V2 REL. CL.;Tobias släpper leksaken som Emanuel inte ser;Tobias släpper leksaken som Emanuel ser inte
V2 REL. CL.;Daniel kastar flaskan som Tobias inte släpper;Daniel kastar flaskan som Tobias släpper inte
V2 REL. CL.;Torgny säljer asken som Daniel inte äger;Torgny säljer asken som Daniel äger inte
V2 REL. CL.;Erik pressar påsen som Torgny inte ser;Erik pressar påsen som Torgny ser inte
V2 REL. CL.;Ulla hittar piskan som Erik inte gillar;Ulla hittar piskan som Erik gillar inte
V2 REL. CL.;Anders vinner pjäsen som Ulla inte hittar;Anders vinner pjäsen som Ulla hittar inte
V2 REL. CL.;Kristina vinner lampan som Anders inte förlorar;Kristina vinner lampan som Anders förlorar inte
V2 REL. CL.;Klara ser motorn som Kristina inte vinner;Klara ser motorn som Kristina vinner inte
V2 REL. CL.;Olle hör tröjan som Klara inte ser;Olle hör tröjan som Klara ser inte
V2 REL. CL.;Helga känner spiken som Olle inte hör;Helga känner spiken som Olle hör inte
V2 REL. CL.;Karl bränner byrån som Helga inte gillar;Karl bränner byrån som Helga gillar inte
V2 REL. CL.;Uma kramar tvålen som Karl inte smakar;Uma kramar tvålen som Karl smakar inte
V2 REL. CL.;Alba glömmer västen som Uma inte river;Alba glömmer västen som Uma river inte
V2 REL. CL.;Rune minns kartan som Alba inte glömmer;Rune minns kartan som Alba glömmer inte
V2 REL. CL.;Iris älskar parfymen som Rune inte minns;Iris älskar parfymen som Rune minns inte
V2 REL. CL.;Vive använder spaden som Iris inte älskar;Vive använder spaden som Iris älskar inte
V2 REL. CL.;Dick hatar tunnan som Vive inte hatar;Dick hatar tunnan som Vive hatar inte
V2 REL. CL.;Runar framställer fiolen som Dick inte önskar;Runar framställer fiolen som Dick önskar inte
V2 REL. CL.;Janice behöver jackan som Runar inte äger;Janice behöver jackan som Runar äger inte
V2 REL. CL.;Elias använder stöveln som Janice inte behöver;Elias använder stöveln som Janice behöver inte
V2 REL. CL.;Pontus missar bollen som Elias inte använder;Pontus missar bollen som Elias använder inte
V2 REL. CL.;Sten äger mötet som Pontus inte missar;Sten äger mötet som Pontus missar inte
V2 REL. CL.;Nico väcker hunden som Albin inte träffar;Nico väcker hunden som Albin träffar inte
V2 REL. CL.;Josefin söver katten som Nico inte gillar;Josefin söver katten som Nico gillar inte
V2 REL. CL.;Nicole tvättar skeden som Josefin inte söker;Nicole tvättar skeden som Josefin söker inte
V2 REL. CL.;Hanna städar rummet som Nicole inte använder;Hanna städar rummet som Nicole använder inte
V2 REL. CL.;Fanny lagar sleven som Hanna inte använder;Fanny lagar sleven som Hanna använder inte
V2 REL. CL.;Ida kokar mattan som Fanny inte lagar;Ida kokar mattan som Fanny lagar inte
V2 REL. CL.;Maj steker köttet som Ida inte kokar;Maj steker köttet som Ida kokar inte
V2 REL. CL.;Majken bakar brödet som Maj inte steker;Majken bakar brödet som Maj steker inte
V2 REL. CL.;Linn skickar bullen som Majken inte bakar;Linn skickar bullen som Majken bakar inte
V2 REL. CL.;Alexander lurar björnen som Linn inte ser;Alexander lurar björnen som Linn ser inte
V2 REL. CL.;Erika ringer kåren som Alexander inte uppskattar;Erika ringer kåren som Alexander uppskattar inte
V2 REL. CL.;Sandra svarar fåret som Erika inte ringer;Sandra svarar fåret som Erika ringer inte
V2 REL. CL.;Kristin beundrar spisen som Sandra inte avgudar;Kristin beundrar spisen som Sandra avgudar inte
V2 REL. CL.;Christine prioriterar tavlan som Kristin inte hyllar;Christine prioriterar tavlan som Kristin hyllar inte
V2 REL. CL.;Caroline mäter rutan som Christine inte dyrkar;Caroline mäter rutan som Christine dyrkar inte
V2 REL. CL.;Ingrid får borsten som Caroline inte prioriterar;Ingrid får borsten som Caroline prioriterar inte
V2 REL. CL.;Inger beställer saxen som Ingrid inte får;Inger beställer saxen som Ingrid får inte
V2 REL. CL.;Aina avbeställer frimärket som Inger inte beställer;Aina avbeställer frimärket som Inger beställer inte
V2 REL. CL.;Ebba ser dörren som Aina inte avbeställer;Ebba ser dörren som Aina avbeställer inte
V2 REL. CL.;Ellen sprider ryktet som Ebba inte gillar;Ellen sprider ryktet som Ebba gillar inte
V2 REL. CL.;Helena delar kakan som Ellen inte smakar;Helena delar kakan som Ellen smakar inte
V2 REL. CL.;Kerstin slipar bryggan som Helena inte delar;Kerstin slipar bryggan som Helena delar inte
V2 REL. CL.;Adam översätter versen som Kerstin inte läser;Adam översätter versen som Kerstin läser inte
V2 REL. CL.;Magdalena förklarar problemet som Adam inte förstår;Magdalena förklarar problemet som Adam förstår inte
V2 REL. CL.;Alice beskriver fjärrkontrollen som Magdalena inte hittar;Alice beskriver fjärrkontrollen som Magdalena hittar inte
V2 REL. CL.;Josef berättar sagan som Alice inte beskriver;Josef berättar sagan som Alice beskriver inte
V2 REL. CL.;John anmäler bänken som Josef inte erkänner;John anmäler bänken som Josef erkänner inte
V2 REL. CL.;Christel avslutar sången som John inte anmäler;Christel avslutar sången som John anmäler inte
V2 REL. CL.;Ann-Katrin påbörjar kapitlet som Christel inte avslutar;Ann-Katrin påbörjar kapitlet som Christel avslutar inte
V2 REL. CL.;Anna-Lena inleder samlingen som Ann-Katrin inte övervägt;Anna-Lena inleder samlingen som Ann-Katrin övervägt inte
V2 REL. CL.;Nada avbryter mötet som Anna-Lena inte planerat;Nada avbryter mötet som Anna-Lena planerat inte
V2 REL. CL.;Linda avslutar festen som Nada inte gillar;Linda avslutar festen som Nada gillar inte
V2 REL. CL.;Maria fortsätter matlagningen som Linda inte tolererar;Maria fortsätter matlagningen som Linda tolererar inte
V2 REL. CL.;Ted räddar trumman som Maria inte omfamnat;Ted räddar trumman som Maria omfamnat inte
V2 REL. CL.;Tobias förstör skruven som Ted inte sett;Tobias förstör skruven som Ted sett inte
V2 REL. CL.;Björn tar klubban som Tobias inte förstör;Björn tar klubban som Tobias förstör inte
V2 REL. CL.;Tryggve låser växeln som Björn inte lagar;Tryggve låser växeln som Björn lagar inte
V2 REL. CL.;Maude packar skrinet som Tryggve inte låser;Maude packar skrinet som Tryggve låser inte
V2 REL. CL.;Adina byter datorn som Maude inte packar;Adina byter datorn som Maude packar inte
V2 REL. CL.;Freja förnekar faktumet som Adina inte föraktar;Freja förnekar faktumet som Adina föraktar inte
V2 REL. CL.;Otis stampar takten som Freja inte ändrar;Otis stampar takten som Freja ändrar inte
V2 REL. CL.;Ylva kastar lappen som Otis inte slår;Ylva kastar lappen som Otis slår inte
V2 REL. CL.;Oscar hindrar katten som Ylva inte klappar;Oscar hindrar katten som Ylva klappar inte
V2 REL. CL.;Henning förevigar pärlan som Oscar inte tvättar;Henning förevigar pärlan som Oscar tvättar inte
V2 REL. CL.;Saga vinner stämpeln som Henning inte omfamnar;Saga vinner stämpeln som Henning omfamnar inte
V2 REL. CL.;Said lämnar skatten som Saga inte vinner;Said lämnar skatten som Saga vinner inte
V2 REL. CL.;Jonas vårdar handsken som Gustaf inte bestjälar;Jonas vårdar handsken som Gustaf bestjälar inte
V3 COMPLEX NP;I sängen som står i gästrummet läser Lisa boken;I sängen som står i gästrummet Lisa läser boken
V3 COMPLEX NP;I rummet som ekar i huset kastar John maten;I rummet som ekar i huset John kastar maten
V3 COMPLEX NP;I ladan som brinner i byn slår Hanna kossan;I ladan som brinner i byn Hanna slår kossan
V3 COMPLEX NP;I vattnet som kokar i kastrullen kramar Niklas bläckfisken;I vattnet som kokar i kastrullen Niklas kramar bläckfisken
V3 COMPLEX NP;I huset som väntar på hyresgäster bygger Pelle bokhyllorna;I huset som väntar på hyresgäster Pelle bygger bokhyllorna
V3 COMPLEX NP;I bastun som ligger på ön dricker Rebecka vinet;I bastun som ligger på ön Rebecka dricker vinet
V3 COMPLEX NP;I skogen som ligger bakom berget klipper herrarna varandra;I skogen som ligger bakom berget herrarna klipper varandra
V3 COMPLEX NP;På berget som ligger i norr spänner Sara bågen;På berget som ligger i norr Sara spänner bågen
V3 COMPLEX NP;Under mattan som hänger på buren äter råttan osten;Under mattan som hänger på buren råttan äter osten
V3 COMPLEX NP;I källaren som ligger under huset äter ormen råttan;I källaren som ligger under huset ormen äter råttan
V3 COMPLEX NP;På väskan som sover på glaset bygger Erik boken;På väskan som sover på glaset Erik bygger boken
V3 COMPLEX NP;I nyckeln som vaknar i täcket river Anna stolen;I nyckeln som vaknar i täcket Anna river stolen
V3 COMPLEX NP;Under dörren som somnar under resväskan målar Lars väskan;Under dörren som somnar under resväskan Lars målar väskan
V3 COMPLEX NP;Över fönstret som går över bron ritar Karin nyckeln;Över fönstret som går över bron Karin ritar nyckeln
V3 COMPLEX NP;Bredvid lampan som springer bredvid uppgiften tänder Olof dörren;Bredvid lampan som springer bredvid uppgiften Olof tänder dörren
V3 COMPLEX NP;Framför väggen som står framför skeden släcker Ingrid fönstret;Framför väggen som står framför skeden Ingrid släcker fönstret
V3 COMPLEX NP;Bakom bordet som står bakom soffan kastar Karl lampan;Bakom bordet som står bakom soffan Karl kastar lampan
V3 COMPLEX NP;Bakom glaset som åker genom bussen fångar Elsa väggen;Bakom glaset som åker genom bussen Elsa fångar väggen
V3 COMPLEX NP;Med koppen som faller utan sången bär Nils bordet;Med koppen som faller utan sången Nils bär bordet
V3 COMPLEX NP;Utan hatten som stiger med brevet lyfter Agnes glaset;Utan hatten som stiger med brevet Agnes lyfter glaset
V3 COMPLEX NP;I jackan som ligger på taket sänker Bengt koppen;I jackan som ligger på taket Bengt sänker koppen
V3 COMPLEX NP;I skjortan som försvinner från fåtöljen höjer Märta hatten;I skjortan som försvinner från fåtöljen Märta höjer hatten
V3 COMPLEX NP;Under skorna som ligger på vägen hämtar Per jackan;Under skorna som ligger på vägen Per hämtar jackan
V3 COMPLEX NP;På mattan som stannar under kartan lämnar Sigrid skjortan;På mattan som stannar under kartan Sigrid lämnar skjortan
V3 COMPLEX NP;I filmen som rullar på tentan knyter studenten skorna;I filmen som rullar på tentan studenten knyter skorna
V3 COMPLEX NP;I sången som ekar i lampan leder Hedda mattan;I sången som ekar i lampan Hedda leder mattan
V3 COMPLEX NP;På tavlan som skiner i rapporten följer Anders filmen;På tavlan som skiner i rapporten Anders följer filmen
V3 COMPLEX NP;Under ringen som brinner i parken söker Lovisa sången;Under ringen som brinner i parken Lovisa söker sången
V3 COMPLEX NP;På kuvertet som rinner genom rummet finner Bo tavlan;På kuvertet som rinner genom rummet Bo finner tavlan
V3 COMPLEX NP;Runt brevet som växer från skärmen vinner Alva ringen;Runt brevet som växer från skärmen Alva vinner ringen
V3 COMPLEX NP;I paketet som mognar på leksaken förlorar Rune kuvertet;I paketet som mognar på leksaken Rune förlorar kuvertet
V3 COMPLEX NP;Under skärmen som åldras på stigen skapar Ida brevet;Under skärmen som åldras på stigen Ida skapar brevet
V3 COMPLEX NP;Bredvid mobilen som sjunker i sjön förstör Sven paketet;Bredvid mobilen som sjunker i sjön Sven förstör paketet
V3 COMPLEX NP;På datorn som stiger över hatten kastar Dagny skärmen;På datorn som stiger över hatten Dagny kastar skärmen
V3 COMPLEX NP;Under spisen som landar bredvid ladan sprider Rolf plantorna;Under spisen som landar bredvid ladan Rolf sprider plantorna
V3 COMPLEX NP;Från ugnen som sitter framför datorn skickar Magda datorn;Från ugnen som sitter framför datorn Magda skickar datorn
V3 COMPLEX NP;På kylen som ligger bakom mobilen tar Sixten spisen;På kylen som ligger bakom mobilen Sixten tar spisen
V3 COMPLEX NP;Genom bollen som ligger under cykeln lagar Tyra ugnen;Genom bollen som ligger under cykeln Tyra lagar ugnen
V3 COMPLEX NP;På leksaken som gråter utan artikeln läser Håkan instruktionen;På leksaken som gråter utan artikeln Håkan läser instruktionen
V3 COMPLEX NP;På tallriken som skrattar i köket skruvar Ebba bollen;På tallriken som skrattar i köket Ebba skruvar bollen
V3 COMPLEX NP;På gaffeln som ler till boken minns Mats leksaken;På gaffeln som ler till boken Mats minns leksaken
V3 COMPLEX NP;Under kniven som skär i golvet glömmer Selma tallriken;Under kniven som skär i golvet Selma glömmer tallriken
V3 COMPLEX NP;Genom skeden som hostar av idén älskar Kjell gaffeln;Genom skeden som hostar av idén Kjell älskar gaffeln
V3 COMPLEX NP;Utanför påsen som nyser åt väggen hatar Astrid kniven;Utanför påsen som nyser åt väggen Astrid hatar kniven
V3 COMPLEX NP;Inuti tröjan som gäspar åt toaletten skildrar Stig skeden;Inuti tröjan som gäspar åt toaletten Stig skildrar skeden
V3 COMPLEX NP;Över kudden som blöder mellan svaren beskriver Vera påsen;Över kudden som blöder mellan svaren Vera beskriver påsen
V3 COMPLEX NP;På täcket som dör bland molnen äter Torsten tröjan;På täcket som dör bland molnen Torsten äter tröjan
V3 COMPLEX NP;I spegeln som sitter vid ån mäter Tilde kudden;I spegeln som sitter vid ån Tilde mäter kudden
V3 COMPLEX NP;Under kartan som föds bakom provet väger Gösta täcket;Under kartan som föds bakom provet Gösta väger täcket
V3 COMPLEX NP;På klockan som trivs i lådan prövar Hanna spegeln;På klockan som trivs i lådan Hanna prövar spegeln
V3 COMPLEX NP;På cykeln som står på hyllan testar Folke kartan;På cykeln som står på hyllan Folke testar kartan
V3 COMPLEX NP;Bakom bilen som åker i byn styr Frida klockan;Bakom bilen som åker i byn Frida styr klockan
V3 COMPLEX NP;Under bussen som står under trappan hindrar Elof cykeln;Under bussen som står under trappan Elof hindrar cykeln
V3 COMPLEX NP;På tåget som åker över mattan räddar Josefina bilen;På tåget som åker över mattan Josefina räddar bilen
V3 COMPLEX NP;Mot flyget som börjar bredvid notisen lutar Arvid bussen;Mot flyget som börjar bredvid notisen Arvid lutar bussen
V3 COMPLEX NP;I resväskan som står framför klockan förbannar Linnea tåget;I resväskan som står framför klockan Linnea förbannar tåget
V3 COMPLEX NP;Bredvid glaset som står på bordet tillverkar Henning flyget;Bredvid glaset som står på bordet Henning tillverkar flyget
V3 COMPLEX NP;I staden som ligger bakom berget reparerar Moa resväskan;I staden som ligger bakom berget Moa reparerar resväskan
V3 COMPLEX NP;I byn som drömmer utan såsen lagar Valter biljetten;I byn som drömmer utan såsen Valter lagar biljetten
V3 COMPLEX NP;På gården som slumrar efter dopet låser Stina ladan;På gården som slumrar efter dopet Stina låser ladan
V3 COMPLEX NP;Hitom huset som flämtar av hostan lånar Algot byn;Hitom huset som flämtar av hostan Algot lånar byn
V3 COMPLEX NP;Under ladan som skälver från tavlan delar Ronja gården;Under ladan som skälver från tavlan Ronja delar gården
V3 COMPLEX NP;Över ängen som skriker av vämjelse förenar Viggo paret;Över ängen som skriker av vämjelse Viggo förenar paret
V3 COMPLEX NP;Bredvid skogen som ropar åt berget skyddar Elvira ladan;Bredvid skogen som ropar åt berget Elvira skyddar ladan
V3 COMPLEX NP;Framför sjön som vilar hos nyckeln försvarar Harald ängen;Framför sjön som vilar hos nyckeln Harald försvarar ängen
V3 COMPLEX NP;Bakom männen som arbetar mellan städerna övervakar Dagmar skogen;Bakom männen som arbetar mellan städerna Dagmar övervakar skogen
V3 COMPLEX NP;Genom parken som ligger i bergen avslutar Einar romanen;Genom parken som ligger i bergen Einar avslutar romanen
V3 COMPLEX NP;På vägen som går vid floden tar Albin droger;På vägen som går vid floden Albin tar droger
V3 COMPLEX NP;På stigen som går kring huset utnyttjar Leif tiggaren;På stigen som går kring huset Leif utnyttjar tiggaren
V3 COMPLEX NP;På bron som andas i skymningen lyfter David hävstången;På bron som andas i skymningen David lyfter hävstången
V3 COMPLEX NP;Från trappan som snarkar på sjön undervisar Oskar studenterna;Från trappan som snarkar på sjön Oskar undervisar studenterna
V3 COMPLEX NP;Under golvet som ligger i tystnaden programmerar Ylva roboten;Under golvet som ligger i tystnaden Ylva programmerar roboten
V3 COMPLEX NP;På taket som glänser under stjärnhimlen erkänner Vilhelm brottet;På taket som glänser under stjärnhimlen Vilhelm erkänner brottet
V3 COMPLEX NP;I dammen som skymtar bakom vägen stör Bodil fiskarna;I dammen som skymtar bakom vägen Bodil stör fiskarna
V3 COMPLEX NP;Mellan rummen som möglar av regnet kastar Edvin plankorna;Mellan rummen som möglar av regnet Edvin kastar plankorna
V3 COMPLEX NP;I toaletten som står framför sängen lägger Ragnhild hammaren;I toaletten som står framför sängen Ragnhild lägger hammaren
V3 COMPLEX NP;Vid duschen som storknar bakom gården förbättrar Hjalmar köket;Vid duschen som storknar bakom gården Hjalmar förbättrar köket
V3 COMPLEX NP;Bakom sängen som står i vardagsrummet väcker Gunhild barnen;Bakom sängen som står i vardagsrummet Gunhild väcker barnen
V3 COMPLEX NP;På soffan som ramlar utan dikten omvandlar Manfred duschen;På soffan som ramlar utan dikten Manfred omvandlar duschen
V3 COMPLEX NP;I fåtöljen som skakar av eltandborsten pryder Siv sängen;I fåtöljen som skakar av eltandborsten Siv pryder sängen
V3 COMPLEX NP;I hyllan som står i duschen befriar Georg jätten;I hyllan som står i duschen Georg befriar jätten
V3 COMPLEX NP;Under vanten som snarkar av novellen prövar Rut fåtöljen;Under vanten som snarkar av novellen Rut prövar fåtöljen
V3 COMPLEX NP;I lådan som lutar av avund fördömer Tryggve brottet;I lådan som lutar av avund Tryggve fördömer brottet
V3 COMPLEX NP;I raketen som passerar genom himlen fördömer Tekla laserkanonen;I raketen som passerar genom himlen Tekla fördömer laserkanonen
V3 COMPLEX NP;I diskmaskinen som brummar av mättnaden avstyr myran katastrofen;I diskmaskinen som brummar av mättnaden myran avstyr katastrofen
V3 COMPLEX NP;På bänken som löper mellan rummen underkuvar Gertrud slavarna;På bänken som löper mellan rummen Gertrud underkuvar slavarna
V3 COMPLEX NP;I drömmen som fortlöper genom sinnet tillintetgör Knut gardinen;I drömmen som fortlöper genom sinnet Knut tillintetgör gardinen
V3 COMPLEX NP;På lusen som darrar vid frågan besegrar Svea drömmen;På lusen som darrar vid frågan Svea besegrar drömmen
V3 COMPLEX NP;Under diskussionen som vandrar kring svaret utmanar Holger idén;Under diskussionen som vandrar kring svaret Holger utmanar idén
V3 COMPLEX NP;Bakom svaret som trampar i drömmen överraskar Rebecka alla;Bakom svaret som trampar i drömmen Rebecka överraskar alla
V3 COMPLEX NP;Uppför slänten som bleknar på filmen ersätter Isak svaret;Uppför slänten som bleknar på filmen Isak ersätter svaret
V3 COMPLEX NP;Inom dikten som vissnar i huset driver Petra tesen;Inom dikten som vissnar i huset Petra driver tesen
V3 COMPLEX NP;Utanför novellen som doftar under spegeln organiserar Pontus papprena;Utanför novellen som doftar under spegeln Pontus organiserar papprena
V3 COMPLEX NP;I kyrkan som står på kullen lagar Ulrika kitteln;I kyrkan som står på kullen Ulrika lagar kitteln
V3 COMPLEX NP;I rapporten som låter bredvid jackan placerar Patrik dikten;I rapporten som låter bredvid jackan Patrik placerar dikten
V3 COMPLEX NP;Bakom boken som ligger framför tallriken justerar Veronica uppsatsen;Bakom boken som ligger framför tallriken Veronica justerar uppsatsen
V3 COMPLEX NP;I rummet som ligger bakom parken granskar Robin provet;I rummet som ligger bakom parken Robin granskar provet
V3 COMPLEX NP;I tentan som ligger på stigen kontrollerar Vendela skogen;I tentan som ligger på stigen Vendela kontrollerar skogen
V3 COMPLEX NP;På häxan som vandrar under bron käkar Thomas mackan;På häxan som vandrar under bron Thomas käkar mackan
V3 COMPLEX NP;Med förstoringsglaset som vilar i handen löser Vive uppgiften;Med förstoringsglaset som vilar i handen Vive löser uppgiften
ELLIPSIS1;Lisa köpte en gul tröja och Calle köpte en röd;Lisa köpte en tröja och Calle köpte en röd
ELLIPSIS1;John kastade ett ruttet äpple och Anna kastade ett färskt;John kastade ett äpple och Anna kastade ett färskt
ELLIPSIS1;Hanna slog en svår knop och Nils slog en lätt;Hanna slog en knop och Nils slog en lätt
ELLIPSIS1;Niklas mördade en otäck bläckfisk och Johanna mördade en söt;Niklas mördade en bläckfisk och Johanna mördade en söt
ELLIPSIS1;Pelle byggde en vacker villa och Sonja byggde en ful;Pelle byggde en villa och Sonja byggde en ful
ELLIPSIS1;Rebecka rev en liten bastu och Klara rev en stor;Rebecka rev en bastu och Klara rev en stor
ELLIPSIS1;Herrarna skövlade en enorm skog och damerna skövlade en pytteliten;Herrarna skövlade en skog och damerna skövlade en pytteliten
ELLIPSIS1;Sara spände en farlig båge och Julia spände en ofarlig;Sara spände en båge och Julia spände en ofarlig
ELLIPSIS1;Tjuvarna sprängde ett tungt bankvalv och poliserna sprängde ett lätt;Tjuvarna sprängde ett bankvalv och poliserna sprängde ett lätt
ELLIPSIS1;Ormen åt en liten råtta och katten åt en stor;Ormen åt en råtta och katten åt en stor
ELLIPSIS1;Ylva åt ett ulligt får och Adam åt ett skyggt;Ylva åt ett får och Adam åt ett skyggt
ELLIPSIS1;Vive vann ett skyggt rådjur och Adina vann ett stolt;Vive vann ett rådjur och Adina vann ett stolt
ELLIPSIS1;Viola hämtade en stolt kanin och Ahmed hämtade en smidig;Viola hämtade en kanin och Ahmed hämtade en smidig
ELLIPSIS1;Uma tvättade ett smidigt lodjur och Aina tvättade ett kasst;Uma tvättade ett lodjur och Aina tvättade ett kasst
ELLIPSIS1;Ulla älskade ett kasst djur och Alba älskade ett resligt;Ulla älskade ett djur och Alba älskade ett resligt
ELLIPSIS1;Tryggve testade en reslig hjort och Albin testade en grym;Tryggve testade en hjort och Albin testade en grym
ELLIPSIS1;Torgny tog ett grymt svin och Alexander tog ett vilt;Torgny tog ett svin och Alexander tog ett vilt
ELLIPSIS1;Tobias tackade ett vilt vildsvin och Alf tackade ett oskyldigt;Tobias tackade ett vildsvin och Alf tackade ett oskyldigt
ELLIPSIS1;Tobias sålde ett oskyldigt lamm och Alice sålde ett rött;Tobias sålde ett lamm och Alice sålde ett rött
ELLIPSIS1;Ted sumpade ett rött lakan och Amer sumpade ett mystiskt;Ted sumpade ett lakan och Amer sumpade ett mystiskt
ELLIPSIS1;Sofie störde ett mystiskt havsdjur och Anders störde ett starkt;Sofie störde ett havsdjur och Anders störde ett starkt
ELLIPSIS1;Sara stal ett starkt lejon och Ann-Katrin stal ett randigt;Sara stal ett lejon och Ann-Katrin stal ett randigt
ELLIPSIS1;Sandra stängde en trasig dörr och Anna stängde en hel;Sandra stängde en dörr och Anna stängde en hel
ELLIPSIS1;Saga skickade ett snabbt meddelande och Anna-Lena skickade ett otrevligt;Saga skickade ett meddelande och Anna-Lena skickade ett otrevligt
ELLIPSIS1;Rune såg ett hjälpsamt par och Beata såg ett slemmigt;Rune såg ett par och Beata såg ett slemmigt
ELLIPSIS1;Robert stal en hal ål och Caroline stal en mager;Robert stal en ål och Caroline stal en mager
ELLIPSIS1;Pontus offrade en mager abborre och Christel offrade en söt;Pontus offrade en abborre och Christel offrade en söt
ELLIPSIS1;Otis skickade en söt sill och Christine skickade en salt;Otis skickade en sill och Christine skickade en salt
ELLIPSIS1;Oscar såg en salt lax och Daniel såg en äcklig;Oscar såg en lax och Daniel såg en äcklig
ELLIPSIS1;Olle tillagade ett äckligt kräftdjur och Dick tillagade ett gyllene;Olle tillagade ett kräftdjur och Dick tillagade ett gyllene
ELLIPSIS1;Nils dödade ett gyllene skaldjur och Donja dödade ett randigt;Nils dödade ett skaldjur och Donja dödade ett randigt
ELLIPSIS1;Niklas pussade en randig höna och Ebba pussade en vild;Niklas pussade en höna och Ebba pussade en vild
ELLIPSIS1;Nicole räddade en vild gås och Elias räddade en vit;Nicole räddade en gås och Elias räddade en vit
ELLIPSIS1;Nico redigerade ett vitt ankdjur och Ellen redigerade ett högljutt;Nico redigerade ett ankdjur och Ellen redigerade ett högljutt
ELLIPSIS1;Nada prövade ett högljutt fjäderfä och Emanuel prövade ett litet;Nada prövade ett fjäderfä och Emanuel prövade ett litet
ELLIPSIS1;Murat planerade ett litet barn och Erik planerade ett syskonlikt;Murat planerade ett barn och Erik planerade ett syskonlikt
ELLIPSIS1;Muhammed påminde ett tramsigt syskon och Erika påminde ett avlägset;Muhammed påminde ett syskon och Erika påminde ett avlägset
ELLIPSIS1;Meriem kittlade ett avlägset kusinbarn och Eva kittlade ett nära;Meriem kittlade ett kusinbarn och Eva kittlade ett nära
ELLIPSIS1;Maude beskyllde ett nära släktingbarn och Fanny beskyllde ett ungt;Maude beskyllde ett släktingbarn och Fanny beskyllde ett ungt
ELLIPSIS1;Mats såg ett ungt småbarn och Farah såg ett busigt;Mats såg ett småbarn och Farah såg ett busigt
ELLIPSIS1;Maria noterade ett busigt förskolebarn och Flora noterade ett oroligt;Maria noterade ett förskolebarn och Flora noterade ett oroligt
ELLIPSIS1;Majken mätte ett oroligt skolbarn och Fredrik mätte ett flitigt;Majken mätte ett skolbarn och Fredrik mätte ett flitigt
ELLIPSIS1;Maj mötte ett flitigt tonårsbarn och Freja mötte ett tyst;Maj mötte ett tonårsbarn och Freja mötte ett tyst
ELLIPSIS1;Magdalena målade ett tyst tvillingbarn och Hanna målade ett delat;Magdalena målade ett tvillingbarn och Hanna målade ett delat
ELLIPSIS1;Linn märkte ett delat fosterbarn och Helena märkte ett ensamt;Linn märkte ett fosterbarn och Helena märkte ett ensamt
